{
  "$schema": "https://json-schema.org/draft/2020-12/schema",
  "type": "object",
  "properties": {
    "schemaVersion": {
      "type": "number",
      "const": 1
    },
    "commandId": {
      "type": "string",
      "minLength": 8,
      "maxLength": 200,
      "pattern": "^[A-Za-z0-9._:-]+$"
    },
    "command": {
      "type": "string",
      "enum": [
        "create_news",
        "create_taxonomy_term",
        "create_timed_content",
        "import_wordpress_asset",
        "update_content",
        "archive_content",
        "rollback_content",
        "schedule_content",
        "attach_asset",
        "replace_asset",
        "update_seo",
        "create_product",
        "update_product",
        "publish_product",
        "archive_product",
        "replace_product_asset",
        "attach_product_asset",
        "remove_product_asset",
        "reorder_product_assets",
        "rollback_product",
        "create_page",
        "update_page",
        "insert_page_section",
        "update_page_section",
        "remove_page_section",
        "reorder_page_sections",
        "replace_page_section_asset",
        "rollback_page",
        "insert_page_section_item",
        "update_page_section_item",
        "remove_page_section_item",
        "reorder_page_section_items",
        "replace_page_section_item_asset"
      ]
    },
    "issuedAt": {
      "type": "string",
      "format": "date-time",
      "pattern": "^(?:(?:\\d\\d[2468][048]|\\d\\d[13579][26]|\\d\\d0[48]|[02468][048]00|[13579][26]00)-02-29|\\d{4}-(?:(?:0[13578]|1[02])-(?:0[1-9]|[12]\\d|3[01])|(?:0[469]|11)-(?:0[1-9]|[12]\\d|30)|(?:02)-(?:0[1-9]|1\\d|2[0-8])))T(?:(?:[01]\\d|2[0-3]):[0-5]\\d(?::[0-5]\\d(?:\\.\\d+)?)?(?:Z))$"
    },
    "context": {
      "type": "object",
      "properties": {
        "ruleVersion": {
          "type": "string"
        },
        "targetSite": {
          "type": "string",
          "minLength": 1,
          "maxLength": 200
        },
        "requiresAssetIntake": {
          "type": "boolean"
        },
        "preflight": {
          "type": "object",
          "properties": {
            "commandDigest": {
              "type": "string",
              "pattern": "^sha256:[a-f0-9]{64}$"
            },
            "contractVersion": {
              "type": "string",
              "minLength": 1,
              "maxLength": 200
            }
          },
          "required": [
            "commandDigest",
            "contractVersion"
          ],
          "additionalProperties": false
        }
      },
      "required": [
        "ruleVersion",
        "targetSite"
      ],
      "additionalProperties": false
    },
    "payload": {}
  },
  "required": [
    "schemaVersion",
    "commandId",
    "command",
    "issuedAt",
    "context",
    "payload"
  ],
  "additionalProperties": false
}
