{
  "schemaVersion": 1,
  "commandId": "example-page-hero-001",
  "command": "update_page_section",
  "issuedAt": "2026-09-08T00:00:00Z",
  "context": {
    "ruleVersion": "0.1.0",
    "targetSite": "example-site"
  },
  "payload": {
    "pageId": "REPLACE_WITH_PAGE_ID",
    "expectedVersion": 1,
    "sectionId": "REPLACE_WITH_SECTION_ID",
    "expectedSectionVersion": 1,
    "sectionType": "hero",
    "variant": "standard",
    "props": {
      "eyebrow": "Example Company",
      "title": "A new homepage message",
      "lead": "This example shows how an implementer can expose a homepage hero as a controlled ChatGPT operation.",
      "primaryCta": {
        "label": "Contact us",
        "href": "/contact/"
      }
    }
  }
}
